[
  {
    "techId": "fireblast",
    "name": "Fireblast",
    "jobClass": "BlackMage",
    "tpCost": 10,
    "tier": 2,
    "rarity": 1,
    "description": "100% Fire Dmg to all opponents",
    "numAttacks": 1,
    "keywords": [],
    "traits": [],
    "targetingType": "All",
    "validTargets": "Enemies",
    "livingOrDead": "Living",
    "targetStatuses": [],
    "userStatuses": [],
    "directEffects": [
      {
        "effectType":"Damage",
        "element":"Fire",
        "calcType":"StandardFormula",
        "powerFactor":1.0
      }
    ]
  }
]