{
  "techId": "fireblast_multi",
  "name": "Fireblast Multi",
  "jobClass": "BlackMage",
  "tpCost": 10,
  "tier": 2,
  "rarity": 1,
  "description": "Copy of Fireblast to test targeting",
  "numAttacks": 3,
  "keywords": [],
  "traits": [],
  "targetingType": "Choose",
  "validTargets": "Enemies",
  "livingOrDead": "Living",
  "allowMultipleAttackOnSameTarget": false,
  "targetStatuses": [],
  "userStatuses": [],
  "directEffects": [
    {
      "effectType": "Damage",
      "element": "Fire",
      "calcType": "StandardFormula",
      "powerFactor": 1
    }
  ]
}
